expresion,palabra,dominio_meta,dominio_fuente,metafora_conceptual,tipo
pregunta macro que orientó la búsqueda de la verdad,orientó,LA BÚSQUEDA DE LA VERDAD,LA DIRECCIÓN,LA BÚSQUEDA DE LA VERDAD ES LA DIRECCIÓN,novedosa
"el conflicto armado no logra cerrarse completamente y, en cambio, se recicla",recicla,EL CONFLICTO ARMADO,LA BASURA,EL CONFLICTO ARMADO ES LA BASURA,novedosa
la magnitud de la información recabada y la preexistente en el país,magnitud,LA MAGNITUD,EL TAMAÑO,LA MAGNITUD ES EL TAMAÑO,novedosa
la magnitud de la información recabada y la preexistente en el país,recabada,LA INFORMACIÓN,LOS RECURSOS,LA INFORMACIÓN ES LOS RECURSOS,novedosa
la magnitud de la información recabada y la preexistente en el país,preexistente,LA INFORMACIÓN,LOS RECURSOS,LA INFORMACIÓN ES LOS RECURSOS,novedosa
"todo lo visto, escuchado, experimentado y reflexionado se sedimentará",sedimentará,"LO QUE SE HA VISTO, ESCUCHADO, EXPERIMENTADO Y REFLEXIONADO",EL SUELDO,"LO QUE SE HA VISTO, ESCUCHADO, EXPERIMENTADO Y REFLEXIONADO ES EL SUELDO",novedosa
